{
  "contract_version": "1",
  "day_id": "day103",
  "release": "release-1-mvp",
  "gate": "forensic_psychology",
  "verdict": "PSYCHOLOGICALLY_CONSISTENT",
  "blocking": false,
  "reviewed_at": "2026-05-24",
  "reviewed_files": [
    "main-game/non-prod-game/game/days/day103_non_canon.rpy"
  ],
  "markdown_verdict_path": "main-game/pipeline/releases/release-1-mvp/days/day103/gates/day103_gate_forensic_psychology.md",
  "follow_up": {
    "writers_room": false,
    "lead_narrative_editor": false,
    "forensic_psychology_consultant": false,
    "victorian_consultant": true,
    "profile_update": false
  }
}
