{
  "contract_version": "1",
  "day_id": "day105",
  "release": "release-1-mvp",
  "gate": "lead_narrative",
  "verdict": "PASS",
  "blocking": false,
  "reviewed_at": "2026-05-22",
  "reviewed_files": [
    "main-game/non-prod-game/game/days/day105_non_canon.rpy"
  ],
  "markdown_verdict_path": "main-game/pipeline/releases/release-1-mvp/days/day105/gates/day105_gate_lead_narrative.md",
  "follow_up": {
    "writers_room": false,
    "lead_narrative_editor": false,
    "forensic_psychology_consultant": true,
    "victorian_consultant": false,
    "profile_update": false
  }
}
