{
  "contract_version": "1",
  "day_id": "day104",
  "release": "release-1-mvp",
  "gate": "victorian",
  "verdict": "HISTORICALLY_SOUND",
  "blocking": false,
  "reviewed_at": "2026-05-25",
  "reviewed_files": [
    "main-game/non-prod-game/game/days/day104_non_canon.rpy"
  ],
  "markdown_verdict_path": "main-game/pipeline/releases/release-1-mvp/days/day104/gates/day104_gate_victorian.md",
  "follow_up": {
    "writers_room": false,
    "lead_narrative_editor": false,
    "forensic_psychology_consultant": false,
    "victorian_consultant": false,
    "profile_update": false
  }
}
