{
  "contract_version": "1",
  "day_id": "day102",
  "release": "release-1-mvp",
  "gate": "forensic_psychology",
  "verdict": "PSYCHOLOGICALLY_CONSISTENT",
  "blocking": false,
  "reviewed_at": "2026-05-23",
  "reviewed_files": [
    "narrative/draft/releases/release-1-mvp/days/day102/day102_non_canon.rpy"
  ],
  "markdown_verdict_path": "narrative/pipeline/releases/release-1-mvp/days/day102/gates/day102_gate_forensic_psychology.md",
  "follow_up": {
    "writers_room": false,
    "lead_narrative_editor": false,
    "forensic_psychology_consultant": false,
    "victorian_consultant": true,
    "profile_update": false
  }
}
