{
  "contract_version": "1",
  "day_id": "day100",
  "release": "release-1-mvp",
  "gate": "lead_narrative",
  "verdict": "PASS",
  "blocking": false,
  "reviewed_at": "2026-06-10",
  "reviewed_files": [
    "narrative/draft/releases/release-1-mvp/non_prod_renpy_project/game/days/day100_non_canon.rpy"
  ],
  "markdown_verdict_path": "narrative/pipeline/releases/release-1-mvp/days/day100/gates/day100_gate_lead_narrative.md",
  "follow_up": {
    "writers_room": false,
    "lead_narrative_editor": false,
    "forensic_psychology_consultant": false,
    "victorian_consultant": false,
    "profile_update": false
  }
}
