{
  "contract_version": "1",
  "day_id": "day102",
  "release": "release-1-mvp",
  "gate": "forensic_psychology",
  "verdict": "PSYCHOLOGICALLY_CONSISTENT",
  "blocking": false,
  "reviewed_at": "2026-06-28",
  "reviewed_files": [
    "main-game/non-prod-game/game/shared/story_chains_non_canon.rpy",
    "main-game/non-prod-game/game/shared/classes_non_canon.rpy",
    "main-game/non-prod-game/game/days/day102_non_canon.rpy",
    "main-game/non-prod-game/game/days/day103_non_canon.rpy"
  ],
  "markdown_verdict_path": "main-game/pipeline/releases/release-1-mvp/shared/gates/story_chains_gate_forensic_psychology.md",
  "follow_up": {
    "writers_room": false,
    "lead_narrative_editor": false,
    "forensic_psychology_consultant": false,
    "victorian_consultant": true,
    "profile_update": false
  },
  "notes": "code-revision-1 chains; abandon/advance split psychologically coherent; no profile delta"
}
